{
  "$schema": "https://json-schema.org/draft/2020-12/schema",
  "$id": "orchestrator-engine://schemas/local-check",
  "title": "First-class local check descriptor",
  "schema_version": 1,
  "kind": "ORCHESTRATOR_LOCAL_CHECK",
  "type": "object",
  "required": ["schema_version", "kind", "check_id", "suite", "verification", "fingerprint", "status", "execution", "requested_execution", "wake_policy", "requested_wake_policy", "long_threshold_seconds", "plan", "created_at", "check_dir"],
  "properties": {
    "schema_version": {"const": 1},
    "kind": {"const": "ORCHESTRATOR_LOCAL_CHECK"},
    "check_id": {"type": "string", "pattern": "^[A-Za-z0-9][A-Za-z0-9_.-]{0,127}$"},
    "suite": {"type": "string", "minLength": 1},
    "verification": {"enum": ["structural", "focused", "full"]},
    "fingerprint": {"type": "string", "pattern": "^[0-9a-f]{64}$"},
    "status": {"enum": ["starting", "running", "passed", "failed", "errored", "cancelled"]},
    "execution": {"enum": ["foreground", "detached"]},
    "requested_execution": {"enum": ["auto", "foreground", "detached"]},
    "wake_policy": {"enum": ["always", "on-failure", "never"]},
    "requested_wake_policy": {"enum": ["auto", "always", "on-failure", "never"]},
    "long_threshold_seconds": {"type": "number", "exclusiveMinimum": 0},
    "plan": {"type": "object"},
    "created_at": {"type": "string", "format": "date-time"},
    "check_dir": {"type": "string", "pattern": "^(?:/|[A-Za-z]:[\\\\/]|\\\\\\\\)"},
    "applicability": {"$ref": "#/$defs/applicabilityMetadata"},
    "wake_target": {"$ref": "orchestrator-engine://schemas/wake-target"},
    "supervisor_pid": {"type": "integer", "minimum": 1},
    "supervisor_identity": {"type": "object"},
    "command_launching": {
      "type": "object",
      "required": ["label", "recorded_at"],
      "properties": {
        "label": {"type": "string", "minLength": 1},
        "recorded_at": {"type": "string", "format": "date-time"}
      },
      "additionalProperties": false
    },
    "active_command": {
      "type": "object",
      "required": ["label", "pid", "process_group", "process_identity", "started_at"],
      "properties": {
        "label": {"type": "string", "minLength": 1},
        "pid": {"type": "integer", "minimum": 1},
        "process_group": {"type": "integer", "minimum": 1},
        "process_identity": {"type": "object"},
        "started_at": {"type": "string", "format": "date-time"}
      },
      "additionalProperties": false
    },
    "active_command_stop": {"type": "object"},
    "started_at": {"type": "string", "format": "date-time"},
    "finished_at": {"type": "string", "format": "date-time"},
    "duration_seconds": {"type": "number", "minimum": 0},
    "result_path": {"type": "string", "pattern": "^(?:/|[A-Za-z]:[\\\\/]|\\\\\\\\)"},
    "summary_path": {"type": "string", "pattern": "^(?:/|[A-Za-z]:[\\\\/]|\\\\\\\\)"},
    "evidence_path": {"type": "string", "pattern": "^(?:/|[A-Za-z]:[\\\\/]|\\\\\\\\)"},
    "event_id": {"type": "string", "pattern": "^[A-Za-z0-9][A-Za-z0-9_.-]{0,127}$"},
    "event_path": {"type": "string", "pattern": "^(?:/|[A-Za-z]:[\\\\/]|\\\\\\\\)"},
    "signal_path": {"type": ["string", "null"]},
    "recovered_at": {"type": "string", "format": "date-time"},
    "error": {"type": "string", "maxLength": 1000}
  },
  "additionalProperties": true,
  "$defs": {
    "digest": {"type": "string", "pattern": "^[0-9a-f]{64}$"},
    "applicabilityMetadata": {
      "type": "object",
      "additionalProperties": false,
      "required": ["producer_version", "attempt_id", "artifact_path", "artifact_sha256", "input_path", "input_raw_sha256", "declaration_sha256", "request_fingerprint", "source_namespace", "native_location_binding", "suite_fingerprint"],
      "properties": {
        "producer_version": {"const": 1},
        "attempt_id": {"type": "string", "pattern": "^[0-9a-f]{8}-[0-9a-f]{4}-[1-5][0-9a-f]{3}-[89ab][0-9a-f]{3}-[0-9a-f]{12}$"},
        "artifact_path": {"const": "applicability.json"},
        "artifact_sha256": {"$ref": "#/$defs/digest"},
        "input_path": {"const": "applicability-input.json"},
        "input_raw_sha256": {"$ref": "#/$defs/digest"},
        "declaration_sha256": {"$ref": "#/$defs/digest"},
        "request_fingerprint": {"$ref": "#/$defs/digest"},
        "source_namespace": {"$ref": "#/$defs/digest"},
        "native_location_binding": {"$ref": "#/$defs/digest"},
        "suite_fingerprint": {"$ref": "#/$defs/digest"}
      }
    }
  }
}
