{
  "schema_version": 1,
  "kind": "ORCHESTRATOR_LOCAL_CHECK",
  "check_id": "CHECK-1",
  "suite": "full",
  "verification": "full",
  "fingerprint": "aaaaaaaaaaaaaaaaaaaaaaaaaaaaaaaaaaaaaaaaaaaaaaaaaaaaaaaaaaaaaaaa",
  "status": "starting",
  "execution": "detached",
  "requested_execution": "auto",
  "wake_policy": "always",
  "requested_wake_policy": "auto",
  "long_threshold_seconds": 30.0,
  "plan": {"recommended_execution": "detached"},
  "created_at": "2026-09-05T10:00:00.000+00:00",
  "check_dir": "/tmp/project/.orchestrator/checks/CHECK-1"
}
